ID,ICON_ID,NAME,COUNT,DAMAGE,SIDE EFFECT,RANGE SHAPE,RANGE,DESC
0,dummy0,기본공격,-1,20,X,One,-1,활을 쏘아서 {0}의 피해를 가한다.
1,dummy1,만월,3,60,O,One,-1,"일직선의 투사체를 발사한다. 제일 먼저 피격된 적에게 {0}의 피해를 주며 표식을 남긴다. 다음턴 공격으로 표식을 터뜨릴 수 있으며, 이전 데미지의 두배의 피해를 입힌다."
2,dummy2,절단,3,40,X,Eight,-1,회전하며 주변 적에게 {0}의 데미지를 준다.
3,dummy3,중력,3,-1,O,One,-1,단일 대상에게 속박을 걸어서 다음턴 이동하지 못하게 한다.
4,dummy4,화염,3,30,X,Six,-1,전방 범위에 화염을 내뿜어 공격한다. {0}의 데미지를 준다.
5,dummy5,반월,3,-1,O,Eight,-1,매턴마다 주변 단일 대상에게 데미지를 주는 포탑을 설치한다.
6,dummy6,월광포화,1,100,X,Nine,-1,전방으로 달의 기운을 발산하여 첫 번째로 맞은 타겟 주변에 높은 데미지를 준다.
